Reuters,https://www.reuters.com/article/us-health-coronavirus-usa-herbs-idUSKBN20W2GR,U.S. coronavirus threat fuels demand for traditional herbal remedies,"NEW YORK (Reuters) - New York City acupuncturist and herbalist Clayton Shiu says demand for traditional Chinese remedies has surged at his practice since March 1, the day New York announced its first case of the novel coronavirus. 
“It was like a light switc… [+3491 chars]",1
BBC News,https://www.bbc.co.uk/news/health-51736185,Coronavirus: What's the risk of flying or taking the train?,"Image copyrightGetty Images
As coronavirus continues to spread, some governments have restricted travel while, elsewhere, individual travellers have been taking their own precautions. 
The BBC has been receiving questions about whether it is safe to fly, go… [+6161 chars]",1
Reuters,https://www.reuters.com/article/us-health-coronavirus-usa-answers-idUSKBN21F0S0,"Your COVID-19 questions, answered","There is a lot of misinformation circulating about the coronavirus, so we took to Instagram, Twitter and Reddit to see what questions have been bugging you, our readers.Below are answers from several healthcare experts who have been following the outbreak. Pl… [+7334 chars]",1
Politico,https://www.politico.com/news/2020/03/18/ronna-mcdaniel-tests-negative-for-coronavirus-136554,Ronna McDaniel tests negative for coronavirus,"Trump hosted a delegation from Brazil, including President Jair Bolsonaro, at the club last week, a number of whom tested positive for coronavirus and had direct contact with Trump. The White House physician, Dr. Sean Conley, announced last Friday that a pers… [+827 chars]",1
The Washington Post,https://www.washingtonpost.com/investigations/coronavirus-death-toll-americans-are-almost-certainly-dying-of-covid-19-but-being-left-out-of-the-official-count/2020/04/05/71d67982-747e-11ea-87da-77a8136c1a6d_story.html,Coronavirus death toll: Americans are almost certainly dying of covid-19 but being left out of the official count - The Washington Post,"A widespread lack of access to testing in the early weeks of the U.S. outbreak means people with respiratory illnesses died without being counted, epidemiologists say. Even now, some people who die at home or in overburdened nursing homes are not being tested… [+12945 chars]",1
BBC News,https://www.bbc.co.uk/news/world-australia-52171181,Coronavirus: Australia launches criminal investigation into Ruby Princess,"Image copyrightEPAImage caption
 The Ruby Princess remains off the coast of Sydney with 200 crew members showing symptoms of the virus
A criminal investigation has been launched in Australia into how cruise ship passengers were allowed to disembark in Sydne… [+3378 chars]",1
BBC News,https://www.bbc.co.uk/news/world-australia-51921403,Coronavirus: Australian scientists map how immune system fights virus,"Image copyrightEPA
Scientists in Australia say they have identified how the body's immune system fights the Covid-19 virus.
Their research, published in Nature Medicine journal on Tuesday, shows people are recovering from the new virus like they would from … [+2935 chars]",1
CNN,https://www.cnn.com/2020/03/12/health/coronavirus-q-and-a-thursday-march-12/index.html,"4 of your latest coronavirus questions, answered","(CNN)CNN readers are asking smart questions about coronavirus every day. So each weekday, we'll select some of the top questions and get you the answers.
Here are some of the most popular recent questions:
Q. Does donated blood get screened for coronavirus?… [+3680 chars]",0
CNN,https://www.cnn.com/videos/us/2020/03/19/dr-anthony-fauci-young-people-coronavirus-swine-flu-cpt-vpx.cnn,Coronavirus expert has warning for young people,Chat with us in Facebook Messenger. Find out what's happening in the world as it unfolds.,0
CNN,https://www.cnn.com/2020/04/03/opinions/social-distancing-atlanta-covid-19-sharma-chahroudi-synyn/index.html,Opinion: What Atlanta's snowmageddon teaches us about social distancing,"Dr. Sujit Sharma is a pediatric emergency medicine physician with Pediatric Emergency Medicine Associates in Atlanta, Georgia. Dr. Ann Chahroudi is an associate professor and associate division chief for Basic/Translational Research, Division of Infectious Di… [+4696 chars]",0
CNN,https://www.cnn.com/2020/04/07/health/10-key-coronavirus-symptoms-wellness/index.html,Coronavirus symptoms: 10 key indicators and what to do,"(CNN)Scientists are learning more each day about the mysterious novel coronavirus and the symptoms of Covid-19, the disease it causes. 
Fever, cough and shortness of breath are found in the vast majority of all Covid-19 cases. But there are additional signal… [+12561 chars]",0
CNN,https://www.cnn.com/2020/03/21/health/georgia-inmates-coronavirus/index.html,Three inmates test positive in Georgia as concerns grow over prison system,"(CNN)Three inmates have tested positive for the coronavirus in Georgia, raising concerns the pandemic could spread within tight prison quarters nationwide.
The inmates at Lee State Prison in Leesburg suffered flu symptoms and were hospitalized Sunday and Mon… [+2114 chars]",0
CNN,https://www.cnn.com/2020/04/05/opinions/donald-trumps-supreme-challenge-opinion-weekly-column-galant/index.html,Opinion: Donald Trump's supreme challenge,"Sign up to get our new weekly column as a newsletter. We're looking back at the strongest, smartest opinion takes of the week from CNN and other outlets.
 (CNN)In the absence of a powerful government, human life is ""solitary, poor, nasty, brutish, and short,… [+14484 chars]",0
CNN,https://www.cnn.com/2020/03/10/opinions/osterholm-coronavirus-interview-bergen/index.html,Opinion: The disease expert who warned us,"Peter Bergen is CNN's national security analyst, a vice president at New America, a professor of practice at Arizona State University. His new book is ""Trump and His Generals: The Cost of Chaos."" The opinions expressed in this commentary are his own. View mor… [+20048 chars]",0
CNN,https://www.cnn.com/2020/03/20/health/coronavirus-vaping-drugs/index.html,"How smoking, vaping and drug use might increase risks from Covid-19","(CNN)Earlier this month, the US Centers for Disease Control and Prevention updated its Covid-19 recommendations to specifically target older adults and people with serious underlying medical conditions. They labeled this group as ""higher risk."" 
However, ano… [+3816 chars]",0
CNN,https://www.cnn.com/2020/03/12/politics/fact-check-copays-coronavirus-testing-treatment/index.html,Fact check: Trump incorrectly suggests insurers will make coronavirus treatment free,"(CNN)President Donald Trump sowed more confusion over coronavirus testing and treatment in his Wednesday night Oval Office address, when he indicated that coronavirus patients could have treatment -- which could run into thousands of dollars for those serious… [+5322 chars]",0
CNN,https://www.cnn.com/2020/03/18/opinions/trumps-malicious-use-of-chinese-virus-filipovic/index.html,Opinion: Trump's malicious use of 'Chinese virus',"Jill Filipovic is a journalist based in New York and author of the book ""The H-Spot: The Feminist Pursuit of Happiness."" Follow her on Twitter. The opinions expressed in this commentary are solely her own. View more opinion articles on CNN
 (CNN)When Donald … [+5215 chars]",0
CNN,https://www.cnn.com/2020/03/14/opinions/in-coronavirus-crisis-america-has-learned-a-lot-about-triump-dantonio/index.html,Opinion: America has learned a lot about Trump during coronavirus crisis,"Michael D'Antonio is the author of the book ""Never Enough: Donald Trump and the Pursuit of Success"" and co-author with Peter Eisner of ""The Shadow President: The Truth About Mike Pence."" The opinions expressed in this commentary are those of the author. View … [+5604 chars]",0
CNN,https://www.cnn.com/2020/03/09/us/coronavirus-university-college-classes/index.html,"Universities in Washington, California and New York cancel in-person classes","(CNN)American universities from California to New York have canceled classes as the novel coronavirus has affected more than 100,000 people and transformed into what CNN is calling a pandemic.
The cancellations have been focused in states and areas hardest h… [+5179 chars]",0
CNN,https://www.cnn.com/2020/03/24/politics/andrew-cuomo-new-york-coronavirus/index.html,Analysis: Everyone needs to see Andrew Cuomo's inspiring words,"(CNN)It's a difficult moment for America. We are in the grips of the coronavirus pandemic, which is sickening thousands and killing hundreds -- all while growing its reach exponentially lately. ""Social distancing"" and ""shelter in place"" have become familiar t… [+3833 chars]",0
CNN,https://www.cnn.com/2020/03/10/opinions/improve-chances-against-coronavirus-opinion-phillips/index.html,How to improve your chances,"James P. Phillips, MD, is an assistant professor of emergency medicine at the George Washington University, where he serves as chief of the Section of Disaster and Operational Medicine. Follow him on Twitter @DrPhillipsMD. The opinions expressed in this comme… [+5407 chars]",0
CNN,https://www.cnn.com/2020/04/03/opinions/hungary-autocrat-covid-19-power-grab-bociurkiw/index.html,Hungarian leader's outrageous power grab,"Michael Bociurkiw is a global affairs analyst and a former spokesman for the Organization for Security and Cooperation in Europe. Follow him on Twitter @WorldAffairsPro. The opinions expressed in this commentary are his; view more opinions on CNN.
 (CNN)In t… [+6406 chars]",0
CNN,https://www.cnn.com/2020/04/07/opinions/terence-kealey-south-korea-listened-to-the-experts/index.html,South Korea listened to the experts,"Dr. Terence Kealey is an adjunct scholar at the Cato Institute and a professor of clinical biochemistry at the University of Buckingham in the United Kingdom, where he served as vice chancellor until 2014. The opinions expressed in this commentary are his own… [+6817 chars]",0
CNN,https://www.cnn.com/2020/03/08/health/coronavirus-nursing-homes-frieden-analysis/index.html,Former CDC director: It's time to restrict visits to nursing homes,"Dr. Tom Frieden is the former director of the US Centers for Disease Control and Prevention, and former commissioner of the New York City Health Department. He is currently president and CEO of Resolve to Save Lives, a global non-profit initiative funded by B… [+6274 chars]",0
CNN,https://www.cnn.com/2020/04/06/opinions/smoking-vaping-covid-19-coronavirus-maa/index.html,Why Covid-19 might make you rethink your smoking habits,"John Maa, MD, is a past president of the San Francisco Marin Medical Society. The opinions expressed in this commentary are his own. Read more opinion at CNN.
 (CNN)A college friend who is now a physician first introduced me to an electronic cigarette in 200… [+7292 chars]",0
Fox News,https://www.foxnews.com/science/africas-mountain-gorillas-face-coronavirus-risk,Africa's mountain gorillas face coronavirus risk,"The coronavirus is putting at risk another vulnerable species, Africa’s endangered mountain gorillas, prompting the closure of a large national park that is home to a third of those gorillas in the world.
Virunga National Park in the Congo said that it will … [+2386 chars]",0
Buzzfeed,https://www.buzzfeed.com/ginarushton/coronovirus-autoimmune-compromised-covid19,Being The Mother Of An Immunosuppressed Four-Year-Old In The Coronavirus Outbreak Is Not Easy,"When skywriting appeared over Sydney, Australia on Thursday that said ""wash hands"", Claire Burrows was delighted.
Her 4-year-old daughter Kate is one of many people with compromised immune systems who are especially vulnerable to the ongoing coronavirus pand… [+4672 chars]",0
BBC News,https://www.bbc.co.uk/news/world-52017835,Stranded abroad as coronavirus closes borders,"With the coronavirus spreading at a rapid pace, many governments have introduced strict controls on domestic and foreign travel.
But this has left many people trapped abroad. Some governments are working to repatriate those facing difficulty. For others thou… [+5123 chars]",1
Ars Technica,https://arstechnica.com/science/2020/03/dont-panic-the-comprehensive-ars-technica-guide-to-the-coronavirus/,Don’t Panic: The comprehensive Ars Technica guide to the coronavirus,"1 with 1 posters participating
Over 100,000 people have been infected with a new coronavirus that has spread widely from its origin in China over the past few months. More than 3,000 have already died. Our comprehensive guide for understanding and navigating… [+16789 chars]",1
Reuters,https://www.reuters.com/article/uk-health-coronavirus-italy-mortgages-idUKKBN20X0XN,Payments on mortgages suspended across Italy...,"ROME (Reuters) - Payments on mortgages will be suspended across the whole of Italy after the coronavirus outbreak, Italy’s deputy economy minister said on Tuesday. 
“Yes, that will be the case, for individuals and households,” Laura Castelli said in an inter… [+363 chars]",1
Reuters,https://www.reuters.com/article/us-health-coronavirus-thailand-cases-idUSKBN21K0NP,"Thailand reports 104 new coronavirus cases, three new deaths","BANGKOK (Reuters) - Thailand reported 104 new coronavirus cases, bringing its total to 1,875 cases, a spokesman for the government’s Center for COVID-19 Situation Administration said on Thursday. 
There were three new deaths in the country, bringing the tota… [+438 chars]",1
BBC News,https://www.bbc.co.uk/news/world-us-canada-51759981,The mother and the murderer,"He was jailed for killing her daughter. 
Then she feared the police had the wrong man.
CHAPTER 1: THE KILLING
The two colleagues knocked tentatively on the front door. Julia and Tawni, who worked at a beauty store in downtown Idaho Falls, hoped their frien… [+37839 chars]",1
The Washington Post,https://www.washingtonpost.com/health/high-blood-pressure-affects-108-million-american-adults-cdc-says/2020/04/02/d1675c38-7508-11ea-87da-77a8136c1a6d_story.html,"High blood pressure affects 108 million American adults, CDC says - Washington Post","About 108 million U.S. adults or some 45 percent of the adult population are living with high blood pressure, according to the Centers for Disease Control and Prevention. Also known as hypertension, it is considered to be a reading of 130/80 or higher. The nu… [+1158 chars]",1
Politico,https://www.politico.com/news/2020/04/01/theranos-elizabeth-holmes-coronavirus-160020,"Judge, defense clash in Theranos case over shelter-in-place orders","Avila, an appointee of President Barack Obama, suggested that most of the work Holmes defense needed to do could be accomplished from home. And to buttress his point, hed apparently done a little research of his own: pulling up a statement Williams &amp; Conn… [+4579 chars]",1
Politico,https://www.politico.com/news/2020/03/20/surgeon-general-jerome-adams-coronavirus-138397,Trump’s new public health 'star',"Until this month, Health and Human Services leaders had worked to limit Adams portfolio, worried that the voluble doctor would go off-script and fail to coordinate his messaging, said four officials in the health department who spoke on condition of anonymity… [+5897 chars]",1
Reuters,https://www.reuters.com/article/us-health-coronavirus-new-orleans-idUSKBN21K1B0,Why is New Orleans' coronavirus death rate seven times New York's? Obesity is a factor,"(Reuters) - The coronavirus has been a far deadlier threat in New Orleans than the rest of the United States, with a per-capita death rate much higher than in New York City. Doctors, public health officials and available data say the Big Easy’s high levels of… [+4656 chars]",1
Independent,https://www.independent.co.uk/news/world/americas/coronavirus-lungs-covid-19-hospital-health-a9428796.html,Video shows how coronavirus spreads through the lungs of otherwise healthy people,"A new video illustrates the way Covid-19 wreaks havoc on the lungs of otherwise healthy individuals. 
The video, created by George Washington University Hospital in Washington DC, shows the lungs of a man who - until a few days prior - had been asymptomatic … [+2306 chars]",1
The Wall Street Journal,https://www.wsj.com/articles/whos-most-at-risk-from-the-coronavirus-11584048476,Who’s Most at Risk From the Coronavirus - Wall Street Journal,"As the new coronavirus spreads around the world, health officials are repeatedly assuring the public: Your risk of getting seriously ill or dying is very lowunless you are older or have an underlying condition.That is a lot of people, including millions of Am… [+9007 chars]",1
Reuters,https://www.reuters.com/article/us-health-coronavirus-turkey-prisoners-idUSKBN21P1WW,"Turkey plans prisoner release, excluding those jailed on post-coup terrorism charges","ISTANBUL (Reuters) - Turkey’s parliament discussed a prisoner release law on Tuesday which aims to ease overcrowding in jails and protect detainees from the coronavirus, but which critics slam for excluding people jailed on terrorism charges in a post-coup cr… [+3846 chars]",1
BBC News,https://www.bbc.co.uk/news/world-europe-52054602,Norway extradites jihadist preacher Mullah Krekar to Italy,"Image copyrightGetty Images
A fundamentalist Iraqi cleric has been extradited to Italy from Norway, despite concerns about the coronavirus.
Mullah Krekar, real name Najmaddin Faraj Ahmad, is considered a terrorist by the UN and the US.
In July 2019 he was … [+1670 chars]",1
Independent,https://www.independent.co.uk/news/world/americas/coronavirus-queens-death-new-york-covid-19-symptoms-us-a9412531.html,"Coronavirus: New York patient dies after being sent home from hospital, reports say","A man in New York has died of the coronavirus after being sent home from a hospital to self-quarantine, according to a report by the New York Post.
Teodosio Torres, 76, was said to have been taken to New York-Presbyterian Queens after showing potential sympt… [+977 chars]",1
The Washington Post,https://www.washingtonpost.com/dc-md-va/2020/03/15/coronavirus-dc-maryland-virginia-updates/,"Live updates: New cases in Md., Va.; NIH employee tests positive for coronavirus; Md. shutters casinos - The Washington Post","Prince William resident Amanda Phommachanh was told Wednesday that her husband needed to be tested for the novel coronavirus. It took a day for doctors to collect his sample, she said, then three more days to get his test results showing that he has coronavir… [+3136 chars]",1
Independent,https://www.independent.co.uk/voices/egypt-nile-war-water-ethiopia-clash-dam-trump-a9390271.html,Blood on the Nile is what's coming if Egypt and Ethiopia continue their war of words over water,"The Nile, one of the wonders of the natural world, finds itself the subject of an escalating war of words. It could turn the river from a source for civilisation and peace to a source of conflict. 
War looms on the horizon after nine years of exhausting nego… [+5257 chars]",1
BBC News,https://www.bbc.co.uk/news/uk-wales-52123656,Coronavirus: Cardiff women's birth plans changed by crisis,"Image copyrightFamily photoImage caption
 Clare Sandbrook was to be on a midwife-led ward but that was re-assigned as an isolation unit for pregnant women with coronavirus
A mother has spoken about her experience giving birth after her plans were disrupted … [+2242 chars]",1
Independent,https://www.independent.co.uk/news/health/coronavirus-italy-doctors-intensive-care-deaths-a9384356.html,'Get ready': Italian doctors warn Europe of coronavirus impact on hospitals,"Italian doctors have warned medics across Europe to ""get ready"" for coronavirus in a letter revealing up to 10 per cent of all those infected with coronavirus need intensive care with hospitals becoming overwhelmed.
The letter, seen by The Independent, revea… [+7378 chars]",1
Independent,https://www.independent.co.uk/news/uk/home-news/coronavirus-nurse-car-stolen-medical-equipment-manchester-a9428471.html,Coronavirus: Nurse has car and medical equipment stolen,"A community nurse in Manchester providing essential care for patients has had her car and nurses kit containing medical equipment stolen.
Victoria Roberts, 33, was about to go to work from her home in Longsight on Thursday morning when it dawned on her her c… [+1810 chars]",1
The Washington Post,https://www.washingtonpost.com/nation/2020/04/07/coronavirus-is-infecting-killing-black-americans-an-alarmingly-high-rate-post-analysis-shows/,African Americans are at higher risk of death from coronavirus - The Washington Post,"As the novel coronavirus sweeps across the United States, it appears to be infecting and killing black Americans at a disproportionately high rate, according to a Washington Post analysis of early data from jurisdictions across the country.
The emerging star… [+9937 chars]",1
CNN,https://www.cnn.com/2020/03/09/health/money-buys-happiness-wellness/index.html,Could money buy happiness after all? A new study thinks so,"(CNN)Does money really buy happiness? It appears to, at least for a small group of German college students who participated in a study on the connection between happiness and altruism, the selfless concern for the well-being of others.
The study found the ac… [+5456 chars]",0
CNN,https://www.cnn.com/2020/03/20/health/coronavirus-response-must-adapt-frieden-analysis/index.html,Former CDC director: There's a long war ahead,"Dr. Tom Frieden is the former director of the US Centers for Disease Control and Prevention, and former commissioner of the New York City Health Department. He is currently president and CEO of Resolve to Save Lives, a global non-profit initiative funded by B… [+13126 chars]",0
CNN,https://www.cnn.com/2020/03/20/health/how-to-see-a-doctor-coronavirus-wellness/index.html,Need to see a health care provider during coronavirus? Here's what to do next,"(CNN)In many ways, Covid-19 is forcing the entire US health care delivery system in the US to mature into the 21st century, whether it is ready or not.
One enormous shift is clear: virtual care, or telemedicine, will become the new normal. 
This week the fe… [+7918 chars]",0
CNN,https://www.cnn.com/travel/article/us-national-parks-closed-coronavirus-wellness/index.html,These US national parks are closed because of coronavirus,"(CNN) Ellis Island was once the United States' busiest immigration hub, with teams of doctors working to prevent the spread of infectious diseases including measles, scarlet fever and diphtheria. 
On March 16, the National Park Service temporarily closed the… [+3061 chars]",0
CNN,https://www.cnn.com/2020/03/20/health/covid-19-recovery-rates-intl/index.html,"Data from China shows the majority of people with Covid-19 only suffer mild symptoms, then recover","(CNN)Most people who contract the novel coronavirus experience mild symptoms, according to data from China, where the worst of the epidemic now appears to be over.
Last month, scientists from the Chinese Center for Disease Control and Prevention published a … [+4204 chars]",0
CNN,https://www.cnn.com/2020/03/12/opinions/coronavirus-prison-population-precautions-jones-jackson/index.html,Smart steps to prevent devastating coronavirus outbreaks in prisons,"CNN host Van Jones and Jessica Jackson are co-founders of #cut50, a bipartisan criminal justice initiative of the Dream Corps. Jones is also the CEO of the REFORM Alliance, an organization for which Jackson serves as the Chief Advocacy Officer. The opinions e… [+4619 chars]",0
CNN,https://www.cnn.com/2020/04/03/us/wife-facetime-husband-coronavirus-death/index.html,A New York woman played her husband their wedding song on FaceTime as he passed away from coronavirus,"(CNN)Maura Lewinger says her husband, Joe, wrote her love letters every morning and left them in her lunch box. 
They weren't just the ""have a great day"" letters, she said, but they described what she meant to him and maybe their plans for the next day or th… [+2891 chars]",0
CNN,https://www.cnn.com/2020/03/13/health/10-sleep-commandments-wellness/index.html,10 commandments for better sleep on World Sleep Day,"(CNN)Air, water, food -- and some would argue sex -- are key ingredients to human survival. In reality, there should be another ""s"" word in that list: sleep.
We're supposed to get between seven and 10 hours of sleep each night, depending on our age, but the … [+7635 chars]",0
CNN,https://www.cnn.com/2020/04/06/opinions/african-americans-covid-19-risk-jones/index.html,The health-care risk African Americans can't ignore,"CNN host Van Jones is the CEO of the REFORM Alliance, a criminal justice organization for which Jessica Jackson serves as the chief advocacy officer. The views expressed in this commentary are his own. View more opinion on CNN.
 (CNN)At the start of any pand… [+9512 chars]",0
CNN,https://www.cnn.com/2020/03/25/health/nicu-no-visitors-coronavirus-atlanta/index.html,Couple who can't see their baby in NICU hope people take social distancing more seriously,"Atlanta, Georgia (CNN)Juan Flores used a single finger to stroke his son's arm. A breathing machine rested under Nico's nose. A thin feeding tube wound down from his mouth, and tiny wires seemed to be connected to every other part of his body. 
Juan wondered… [+4686 chars]",0
CNN,https://www.cnn.com/2020/04/02/health/us-coronavirus-thursday/index.html,39 US states have ordered residents home after experts continue pushing for aggressive measures to fight coronavirus,"(CNN)Coronavirus deaths across the UShave topped 5,000 and all but 11 states have issued sweeping orders for residents to stay home -- affecting nearly 90% of the country's population.
""What are you waiting for? What more evidence do you need? If you think i… [+5473 chars]",0
