Politico,https://www.politico.com/news/2020/03/09/biden-priorities-usa-gop-attacks-124136,Biden to get cover from major super PAC as GOP attacks ramp up,"Republicans have started building lines of attack on Biden in the days following his string of victories in South Carolina and Super Tuesday states. Trump and allies on Capitol Hill have re-upped their focus on the Biden family's business dealings, a likely l… [+1299 chars]",1
BBC News,https://www.bbc.co.uk/sport/football/52051796,Coronavirus: Brighton player 'OK' after testing positive,"Brighton are 15th in the Premier League with nine games remaining
An unnamed Brighton player has tested positive for coronavirus but is ""OK"", says chief executive Paul Barber.
Three Seagulls players underwent tests after showing symptoms of Covid-19, with o… [+746 chars]",1
BBC News,https://www.bbc.co.uk/sport/mixed-martial-arts/52129874,UFC 249: Khabib-Ferguson cancelled for a fifth time,"Khabib Nurmagomedov and Tony Ferguson were held apart by Dana White
Unbeaten UFC lightweight champion Khabib Nurmagomedov says his long-awaited fight against American Tony Ferguson has been cancelled for a fifth time.
The pair were set to meet on 18 April i… [+985 chars]",1
BBC News,https://www.bbc.co.uk/news/stories-52066956,Coronavirus: The month everything changed,"Image copyrightGetty Images/Alamy
In the space of a month, the United Kingdom has transformed beyond recognition. And most of us haven't had time to stop and take stock.
One Friday afternoon, when the UK was another country, a chalkboard leaned against the … [+10647 chars]",1
Buzzfeed,https://www.buzzfeed.com/abbykass/best-workout-streaming-apps,14 Of The Best Workout Apps To Use At Home,,0
Buzzfeed,https://www.buzzfeed.com/alanwhite/joe-wicks-workout-money-nhs,"""Britain's PE Teacher"" Joe Wicks Is GIving All The Money He Makes From His Workout Videos To The NHS","Wicks told the The Times that this was the realisation of a long-awaited dream: ""I said, In five or ten years time youll remember me as the person not who sold books and had a business, but as someone who completely changed the face and culture of fitness in … [+6 chars]",0
CNN,https://www.cnn.com/2020/04/01/entertainment/joe-wicks-donation-nhs-intl-scli-gbr/index.html,"Joe Wicks to donate $100,000 from YouTube kids' exercise videos to NHS","London (CNN)Fitness trainer Joe Wicks says he plans to donate $100,000 raised from his YouTube exercise videos to the UK's National Health Service (NHS) staff on the frontline of the coronavirus pandemic.
The so-called ""Body Coach,"" who has become the world'… [+1377 chars]",0
CNN,https://www.cnn.com/style/article/yves-behar-home-gym-forme-wellness/index.html,Is this AI-powered 'mirror gym' the future of home exercise?,"design
For many Americans, regular exercise is an elusive commitment -- one made at the beginning of January that peters out within weeks or months. Busy work schedules, a lack of motivation and unease towards exercising in public all contribute to the disma… [+4365 chars]",0
CNN,https://www.cnn.com/2020/04/03/cnn-underscored/best-home-workout-equipment-outbrain-2/index.html,Upgrade your home workout with this top-rated fitness gear,"While the past few weeks have seen us all start to continuously sanitize everything we come into contact with, as well as wash our hands for at least 20 seconds, the most recent effort to stop the spread of coronavirus has involved companies asking their empl… [+13618 chars]",0
CNN,https://www.cnn.com/2020/03/26/cnn-underscored/best-home-workout-equipment-outbrain/index.html,Upgrade your home workout with this top-rated fitness gear,"While the past few weeks have seen us all start to continuously sanitize everything we come into contact with, as well as wash our hands for at least 20 seconds, the most recent effort to stop the spread of coronavirus has involved companies asking their empl… [+13617 chars]",0
CNN,https://www.cnn.com/2020/03/25/world/joe-wicks-coronavirus-workout-wellness-trnd/index.html,"Joe Wicks has become the world's PE teacher, helping kids keep active while we're social distancing","(CNN)With millions of children out of school around the world, Joe Wicks, a YouTube fitness instructor, has taken it upon himself to become their PE teacher. 
Live from his home in London, Wicks live-streams child-friendly workouts every weekday morning at 9… [+1735 chars]",0
CNN,https://www.cnn.com/2020/04/01/business/fitness-studios-coronavirus/index.html,The $94 billion fitness industry is reinventing itself as Covid-19 spreads,"New York (CNN Business)As the coronavirus continues to spread, fitness studios around the country are shutting their doors and adjusting to a new reality. The sudden shift has inspired creativity and flexibility for gyms and studios, which are largely depende… [+5588 chars]",0
CNN,https://www.cnn.com/2020/04/06/africa/nigeria-weight-loss-reality-tv/index.html,"'The Fastest Shedder,' the reality show fighting obesity in Nigeria","Lagos, Nigeria (CNN)Fitness trainer and healthy lifestyle enthusiast, Seyi Olusore is helping people keep fit and lose weight through his show -- the 'Fastest Shedder.'
The show, which started in 2015, is Nigeria's first weight-loss reality show and is model… [+2999 chars]",0
CNN,https://www.cnn.com/2020/03/12/politics/donald-trump-joe-biden-mental-fitness/index.html,The Point: The Trump team is now working overtime to question Joe Biden's mental fitness,"THE POINT -- NOW ON YOUTUBE! 
In each episode of his weekly YouTube show, Chris Cillizza will delve a little deeper into the surreal world of politics. Click to subscribe!",0
CNN,https://www.cnn.com/2020/03/26/politics/army-coronavirus-training/index.html,US Army says coronavirus mitigation efforts 'have proven insufficient' as it suspends some non-critical training,"Washington (CNN)The US Army says mitigation efforts to blunt the spread of the coronavirus ""have proven insufficient"" within the service and it is suspending ""non-mission essential functions,"" including some non-critical training of units in the field and phy… [+5031 chars]",0
CNN,https://www.cnn.com/2020/03/12/politics/donald-trump-joe-biden-mental-fitness/index.html,The Trump team is now working overtime to question Joe Biden's mental fitness,"THE POINT -- NOW ON YOUTUBE! 
In each episode of his weekly YouTube show, Chris Cillizza will delve a little deeper into the surreal world of politics. Click to subscribe!",0
CNN,https://www.cnn.com/2020/03/11/health/cycling-to-work-benefits-injuries-wellness/index.html,"Biking to work appears more dangerous than other commuting options, study finds","(CNN)Cycling to work can lead to better fitness and health, but to some biking newbies it can feel like an accident waiting to happen. 
The fear of injury while cycling through traffic deters many people from biking to work. In the UK, only 4% of people cycl… [+3521 chars]",0
CNN,https://www.cnn.com/2020/04/07/cnn-underscored/home-gym-equipment/index.html,Workout equipment that won't take up a ton of space,"CNN Underscored has interviewed experts to find the best options to help you cope during this uncertain time. Find all of our coronavirus-related coverage here, and let us know your thoughts here.
At this point, most of us are stuck inside self-quarantining,… [+5800 chars]",0
Fox News,https://www.foxnews.com/tech/5-ways-tech-can-help-you-stay-sane-while-you-stay-home,5 ways tech can help you stay sane while you stay home - Fox News,"I can’t stop thinking that I am in the middle of a thriller about a sinister virus that causes a global pandemic. But this is no made-for-Hollywood screenplay. It’s a real catastrophe.
Many people are dealing with frustrating tech challenges while trying to … [+6686 chars]",0
CNN,https://edition.cnn.com/2020/04/02/sport/maxime-mbanda-rugby-coronavirus-italy-spt-intl/index.html,"""It's unreal,' says Italian rugby star Maxime Mbanda as he tackles coronavirus' frontline","(CNN)As Maxime Mbanda prepared for a Six Nations match earlier this month, he never anticipated how he would spend the next few weeks. 
The Italian rugby international was poised to make an injury comeback before the Test match against England that was subse… [+3332 chars]",0
CNN,https://cnnespanol.cnn.com/2020/04/02/5-cosas-que-debes-saber-este-2-de-abril-si-vas-a-usar-mascarilla-haz-estas-tres-cosas/,"5 cosas que debes saber este 2 de abril: Si vas a usar mascarilla, haz estas tres cosas","Personas sin síntomas pero contagiadas están impulsando el brote de coronavirus. Un estudio estima el número de vidas que ha salvado el distanciamiento social en Europa. ¿Por qué los hombres se lavan las manos menos que las mujeres? Además, te traemos una guí… [+4780 chars]",0
CNN,https://www.cnn.com/2020/04/05/politics/pentagon-face-masks-esper-coronavirus-military/index.html,Official says some Pentagon employees told to wear face coverings to work Monday,"Washington (CNN)Some Pentagon employees began receiving emails from their office administrators over the weekend to come to work Monday with at least one face covering to prevent the spread of coronavirus, an official who received one of the messages told CNN… [+2141 chars]",0
CNN,https://www.cnn.com/2020/03/20/health/exercise-gym-close-coronavirus-quarantine-wellness-jampolis/index.html,How do I effectively exercise and stay active now that my gym has closed or I'm quarantined?,"(CNN)Coronavirus concerns, social distancing, gym closures and home confinement may tempt you to just curl up on the couch and binge-watch Netflix, or lose yourself all day in a great novel.
But regular exercise is essential for supporting healthy immune fun… [+8628 chars]",0
The American Conservative,https://www.theamericanconservative.com/articles/should-i-get-out-of-the-military/,Should I Get Out of the Military?,"A reformed Army officer's exchange with a disillusioned active duty soul in need turns thoughtful. I recently had an email exchange with a fellow officer who reached out after reading some of my articles regarding the state of the U.S. Army, the forever wars,… [+12284 chars]",0
The Wall Street Journal,https://www.wsj.com/articles/how-to-avoid-eating-all-day-while-coronavirus-keeps-us-working-from-home-11584983075,How to Avoid Eating All Day...,"Working from home is no picnicor at least, it isnt supposed to be. 
But for many newly remote employees, working steps away from a (now) fully stocked kitchen looks a lot like an all-day buffet. Social distancing could keep many of us indoors for weeks with … [+233 chars]",1
Independent,https://www.independent.co.uk/life-style/coronavirus-healthy-food-how-to-eat-lockdown-a9442241.html,Coronavirus: How to eat healthily while in lockdown,"The UK government is facing calls to launch a healthy eating campaign to educate the nation on how food can boost the immune system during lockdown.
On Thursday, a group of leading food policy experts including Tim Lang, professor of food policy at City Univ… [+9980 chars]",1
Reuters,https://www.reuters.com/article/us-health-men-diet-testicular-idUSKBN2103FQ,"Even among young men, healthier diet tied to higher sperm counts","(Reuters Health) - Young men who care about their sperm quality might want to lay off the cheeseburgers and fries, according to a new study that links a typical Western diet with a lower sperm count. 
Men in the study who ate a mostly Western diet characteri… [+2785 chars]",1
Reuters,https://www.reuters.com/article/us-health-diet-eggs-idUSKBN20Z3ML,More evidence up to an egg a day may not raise heart risk,"(Reuters Health) - People who eat an egg a day are no more likely to have heart attacks or strokes than those who steer clear of eggs, a large study suggests. 
“Moderate egg consumption up to one egg per day is not associated with cardiovascular disease risk… [+3710 chars]",1
The Washington Post,http://www.washingtonpost.com/lifestyle/wellness/anxiety-coronavirus-mental-wellness-tips/2020/03/16/f187faf2-67b8-11ea-9923-57073adce27c_story.html,Psychologist's science-based tips for emotional resilience...,"As the news about the coronavirus pandemic becomes grimmer, and governments and businesses issue closing or work-from-home directives, many of us are experiencing a variety of negative emotions. We feel anxiety in response to the uncertainty of the situation;… [+7738 chars]",1
BBC News,https://www.bbc.co.uk/news/health-52197594,Coronavirus: What is the risk to men over 50?,"Image copyrightGetty Images
Most people with coronavirus will recover within about a week of getting symptoms and will not need medical care.
But some people will need to be treated in hospital - including the prime minister. 
Boris Johnson, who is 55, is … [+4399 chars]",1
Independent,https://www.independent.co.uk/life-style/health-and-families/sleep-deprivation-video-effects-body-mind-human-health-cancer-alzheimers-dementia-brain-damage-a8153851.html,Sleep deprivation video reveals its shocking effects,"A viral video has revealed the shocking detrimental effects that sleep deprivation can have, both on your mental and physical state.
In todays day and age, many of us are prone to going to bed later than we should or having just enough sleep to function effi… [+7254 chars]",1
Reuters,https://www.reuters.com/article/us-health-coronavirus-fiction-factbox-idUSKBN2142UC,Factbox: COVID-19 and the new coronavirus - Fact versus fiction,"LONDON (Reuters) - Social media is awash with myths about how people might stop the new coronavirus or treat infection with COVID-19, the disease it causes. 
Here are some facts to address the fiction: 
TRANSMISSION 
Fiction: 
* The new coronavirus can be… [+2922 chars]",1
Independent,https://www.independent.co.uk/life-style/health-and-families/coronavirus-how-stay-fit-home-lockdown-a9429931.html,Coronavirus: How to stay fit at home during lockdown,"Many countries are now under lockdown. This measure is crucial to minimise the spread of Covid-19, but what impact will it have on health and wellbeing?
Research shows that being sedentary is bad for your physical and mental health, so staying active during … [+4285 chars]",1
Reuters,https://www.reuters.com/article/us-health-coronavirus-usa-zoo-idUSKBN21O2Y2,"Tiger with COVID-19 gets meds, TLC from New York's Bronx Zoo keepers","NEW YORK (Reuters) - Nadia, the tiger who tested positive for the novel coronavirus in New York, and six other big cats who developed a dry cough at the Bronx Zoo appeared to be on the mend on Monday after doses of medication and tenderness. 
“A little TLC b… [+1824 chars]",1
The Washington Post,https://www.washingtonpost.com/health/2020/03/10/social-distancing-coronavirus/,Social distancing could buy U.S. valuable time against coronavirus - The Washington Post,"The best way to prevent a catastrophic explosion of new cases in the next few weeks, many experts think, is to break potential chains of transmission by preventing sick people from coming in close contact with healthy ones, whether it means canceling conferen… [+7783 chars]",1
Independent,https://www.independent.co.uk/life-style/food-and-drink/vegan-meals-salt-unhealthy-restaurant-takeaway-papa-johns-bella-italia-a9389396.html,"Some vegan meals contain more salt than seven McDonald's hamburgers, study finds","Vegan meals served in restaurants and takeaways are often packed with dangerously high levels of salt, new research suggests.
Current health guidelines from the NHS state that adults should eat no more than 6g of salt a day, or around one teaspoon.
However,… [+24090 chars]",1
Independent,https://www.independent.co.uk/voices/coronavirus-lockdown-new-york-therapy-anxiety-addiction-a9404751.html,I learnt the best ways to cope with a coronavirus lockdown in addiction therapy,"When I landed a two-book deal during the coronavirus shutdowns on Friday the 13th, my husband asked, ""Have you noticed you always thrive, business-wise, during disasters? 
A liberal Jewish New York workaholic, I felt guilty and ghoulish. Although inadvertent… [+6745 chars]",1
Politico,https://www.politico.com/news/2020/03/09/america-workers-outbreak-uncertainty-124191,America’s workers face an outbreak of uncertainty,"Americans are going home and creating an economic train wreck.
The coronavirus outbreak has U.S. companies starting to shutter offices and send workers home through layoffs, furloughs or directives to telecommute until health risks from the spreading virus r… [+7852 chars]",1
Reuters,https://www.reuters.com/article/us-health-coronavirus-trump-guidelines-f-idUSKBN2133QU,Factbox: Trump issues guidelines on '15 days to slow the spread',"WASHINGTON (Reuters) - President Donald Trump issued new guidelines on Monday aimed at slowing the spread of the coronavirus in the United States over the next 15 days. The White House list states: 
- Listen and follow the directions of your state and local … [+2948 chars]",1
Independent,https://www.independent.co.uk/voices/coronavirus-quarantine-weight-gain-loss-fatphobic-tess-holliday-a9435901.html,Stop calling me 'fatphobic' for joking about my quarantine weight. I reserve the right to comment on my own body,"Recently, I sent a tweet that I thought was pretty innocent out into the world: Im gonna get so fat self-isolating because I dont know how (or wont) ration.
The response was hardly mind-blowing.Seven people liked it and one friend replied with a picture of d… [+4252 chars]",1
Politico,https://www.politico.com/news/magazine/2020/03/22/cologne-sanitizer-boxed-wine-and-bidets-how-people-in-68-countries-are-coping-with-coronavirus-140648,"Cologne Sanitizer, Boxed Wine and Bidets: How People in 68 Countries Are Coping With Coronavirus","Not everyone uses toilet paper
You probably think everybodys buying toilet paper. And across the Western world, youd be right. A dramatic supermarket fight over TP between two Australian women went viral. When the Dutch prime minister visited a grocery store… [+17147 chars]",1
The Washington Post,https://www.washingtonpost.com/politics/2020/03/17/devin-nuness-bad-clean-up-effort-his-coronavirus-comments/,Devin Nunes’s bad clean-up effort on his coronavirus comments,"Rep. Devin Nunes (R-Calif.) on Sunday morning urged people to go to bars and restaurants, even while Dr. Anthony S. Fauci was on other shows urging the opposite. Trump then on Monday echoed Fauci, saying the administration was urging people to avoid discretio… [+3338 chars]",1
The Washington Post,https://www.washingtonpost.com/health/2020/03/23/coronavirus-isnt-alive-thats-why-its-so-hard-kill/,The coronavirus isn’t alive. That’s why it’s so hard to kill. - The Washington Post,"But as soon as it gets into a human airway, the virus hijacks our cells to create millions more versions of itself.
There is a certain evil genius to how this coronavirus pathogen works: It finds easy purchase in humans without them knowing. Before its first… [+9469 chars]",1
BBC News,https://www.bbc.co.uk/news/world-51735367,Coronavirus: The fake health advice you should ignore,"Image copyrightGetty ImagesImage caption
 Garlic: It may be good for general health, but it won't stop the coronavirus
Coronavirus is emerging in more countries around the world and there's currently no known cure. Unfortunately that hasn't stopped a slew o… [+6714 chars]",1
CNN,https://www.cnn.com/2020/03/14/us/what-to-do-this-weekend-coronavirus-trnd/index.html,Social distancing doesn't have to doom your weekends. We have ideas,"By Scottie Andrew, CNN 
Updated 7:15 AM ET, Sat March 14, 2020
Chat with us in Facebook Messenger. Find out what's happening in the world as it unfolds.
(CNN)The novel coronavirus pandemic is upending our way of life. That includes our beloved weekends. 
… [+8117 chars]",0
CNN,https://www.cnn.com/2020/03/31/health/stress-eating-coronavirus-drayer-wellness/index.html,Stress eating these days? Here's some help,"(CNN)Stress eating is something that many people struggle with on a regular basis, when things are ""normal."" But with the coronavirus pandemic challenging us in different ways each day, it seems to have become an equal opportunity problem, affecting even thos… [+8845 chars]",0
CNN,https://www.cnn.com/2020/03/10/health/eat-breakfast-or-fast-drayer-wellness/index.html,"To eat, or not to eat breakfast -- that is the question","(CNN)Is breakfast still the most important meal of the day? We used to know the answer to that question, right? 
And now we're not so sure.
As a registered dietitian, I always recommend starting the day with a healthy breakfast. And during the past 20 years… [+7031 chars]",0
CNN,https://www.cnn.com/2020/04/06/africa/nigeria-weight-loss-reality-tv/index.html,"'The Fastest Shedder,' the reality show fighting obesity in Nigeria","Lagos, Nigeria (CNN)Fitness trainer and healthy lifestyle enthusiast, Seyi Olusore is helping people keep fit and lose weight through his show -- the 'Fastest Shedder.'
The show, which started in 2015, is Nigeria's first weight-loss reality show and is model… [+2999 chars]",0
CNN,https://www.cnn.com/2020/03/17/health/coronavirus-quarantine-grocery-list-drayer-wellness/index.html,"Grocery rules for your coronavirus lockdown: Buy beans, freeze milk, don't hoard, and more","(CNN)Whether you're housebound for the next couple of weeks from a COVID-19 quarantine, or simply trying to survive a school or work shutdown, you'll likely be limiting or avoiding trips to the grocery store. 
So you may be wondering: What are the best foods… [+10165 chars]",0
CNN,https://www.cnn.com/2020/03/18/cnn-underscored/travel-and-stay-safe/index.html,"If you have to travel right now, here's how to stay as safe as possible","While some of us have the ability to work from home and cancel travel, there are plenty of people who do not. For those who must take a plane, train, bus or taxi or drive a long distance, for business or personal reasons, we've compiled some expert tips for s… [+6935 chars]",0
CNN,https://www.cnn.com/2020/03/18/cnn-underscored/best-meal-delivery-service/index.html,Staying home? These meal kit delivery services will keep you eating well,"As more and more Americans are opting to work from home amid the coronavirus pandemic, they've also been buying toilet paper and sanitizing wipes in bulk not to mention clearing grocery stores of bread, pasta, frozen pizzas and other staples. One easy way to … [+11256 chars]",0
CNN,https://www.cnn.com/2020/04/03/cnn-underscored/best-meal-delivery-service-outbrain-2/index.html,Staying home? These meal kit delivery services will keep you eating well,"We've interviewed experts and found the best options to help you cope during this uncertain time. Find all of our coronavirus-related coverage here, and let us know your thoughts here.
As more and more Americans are opting to work from home amid the coronavi… [+10175 chars]",0
CNN,https://www.cnn.com/2020/03/27/cnn-underscored/best-meal-delivery-service-outbrain/index.html,Staying home? These meal kit delivery services will keep you eating well,"We've interviewed experts and found the best options to help you cope during this uncertain time. Find all of our coronavirus-related coverage here, and let us know your thoughts here.
As more and more Americans are opting to work from home amid the coronavi… [+10175 chars]",0
CNN,https://www.cnn.com/2020/03/26/health/immunity-exercise-sleep-meditation-stress-coronavirus-drayer-wellness/index.html,"How to strengthen your immunity during the coronavirus pandemic: Exercise, meditation, sleep and stress management","(CNN)As the coronavirus situation intensifies, you might be wondering: How can I keep myself healthy?
The answer lies in following the latest guidelines on social distancing, proper handwashing and your local stay-at-home directives. 
But there are also way… [+8321 chars]",0
CNN,https://www.cnn.com/2020/03/25/world/coronavirus-newsletter-03-25-20/index.html,What you need to know about coronavirus today,"(CNN)""This is not a moment of celebration -- but of necessity,"" US Senate Minority Leader Chuck Schumer said as the White House and Senate lawmakers reached a historic $2-trillion stimulus deal early this morning, amid growing coronavirus fears. The Senate wi… [+7299 chars]",0
CNN,https://www.cnn.com/2020/03/23/health/yale-happiness-course-wellness/index.html,Yale's massively popular 'happiness' course is available free online,"(CNN)As you're spending more time at home and working to stay saneduring the coronavirus pandemic, you might be able to find solace in YaleUniversity's mega-popular ""happiness"" course, which is available for free online through Coursera.
""We're in a particul… [+3620 chars]",0
CNN,https://www.cnn.com/2020/03/13/health/10-sleep-commandments-wellness/index.html,10 commandments for better sleep on World Sleep Day,"(CNN)Air, water, food -- and some would argue sex -- are key ingredients to human survival. In reality, there should be another ""s"" word in that list: sleep.
We're supposed to get between seven and 10 hours of sleep each night, depending on our age, but the … [+7635 chars]",0
CNN,https://www.cnn.com/2020/03/10/opinions/college-university-coronavirus-low-income-students-filipovic/index.html,Coronavirus decisions creates big burden for college students,"Jill Filipovic is a journalist based in New York and author of the book ""The H-Spot: The Feminist Pursuit of Happiness."" Follow her on Twitter. The opinions expressed in this commentary are solely her own. View more opinion articles on CNN
 (CNN)For students… [+6242 chars]",0
