BBC News,https://www.bbc.co.uk/news/world-52092898,Coronavirus: Hard-hit Spain's coronavirus outbreak 'slowing',"Image copyrightGetty ImagesImage caption
 A temporary hospital in the Ifema exhibition centre in Madrid opened to patients last week
The growth in coronavirus cases in hard-hit Spain appears to be slowing, the country's foreign minister has told the BBC.
A… [+3116 chars]",1
BBC News,https://www.bbc.co.uk/news/world-52089337,Coronavirus: Field hospitals treating coronavirus patients around world,"Image copyrightGetty ImagesImage caption
 A field hospital in Rafah, Gaza Strip
Coronavirus cases globally have now reached more than 720,000, with at least 34,000 deaths.
To cope with pressure that threatens to overwhelm health systems, countries are buil… [+3407 chars]",1
BBC News,https://www.bbc.co.uk/news/business-52104978,Will coronavirus reverse globalisation?,"Image copyrightGetty ImagesImage caption
 Coronavirus has halted may global deliveries
Globalisation has been one of the buzzwords of the past 25 years.
It may seem a rather strange concept, since any economic historian will tell you that people have been … [+7228 chars]",1
BBC News,https://www.bbc.co.uk/news/world-europe-51810673,Italy extends coronavirus measures nationwide,"Italy is extending its strict coronavirus quarantine measures, which include a ban on public gatherings, to the entire country. 
Prime Minister Giuseppe Conte said the measures, which come into effect on Tuesday, were necessary to defend the most fragile mem… [+489 chars]",1
BBC News,https://www.bbc.co.uk/news/world-51948578,Coronavirus slowdown seen from space,"Image copyrightMaxar
Satellite images of normally busy locations around the world show how the coronavirus is having an impact on travel and tourism.
In Vermont, car parks are empty as skiers keep away from the resort at Killington. Gatherings of 50 or more… [+743 chars]",1
BBC News,https://www.bbc.co.uk/news/world-europe-51897069,Coronavirus: European nations tighten clampdown,"Image copyrightGetty ImagesImage caption
 Several Austrian ski resorts were under quarantine before the new measures were announced
Several European nations have introduced more stringent restrictions on movement as they combat the spread of the coronavirus… [+4111 chars]",1
BBC News,https://www.bbc.co.uk/news/stories-52066956,Coronavirus: The month everything changed,"Image copyrightGetty Images/Alamy
In the space of a month, the United Kingdom has transformed beyond recognition. And most of us haven't had time to stop and take stock.
One Friday afternoon, when the UK was another country, a chalkboard leaned against the … [+10647 chars]",1
BBC News,https://www.bbc.co.uk/news/in-pictures-52150022,Coronavirus: 24 hours on lockdown,"Seventeen years ago, a group of 24 photographers set out to document every hour of New Year's Day, every year, for 24 years. But during these unprecedented times, members of the collective have come together again, this time turning their attention and lenses… [+2675 chars]",1
BBC News,https://www.bbc.co.uk/news/in-pictures-52155029,Coronavirus: Sophie Raworth's deserted London,"For the past two weeks, since the lockdown restrictions began, BBC news presenter Sophie Raworth has been running to work at lunchtime to present the BBC News at Six and Ten, taking pictures as she passes some well-known landmarks. Here she describes what it … [+3949 chars]",1
BBC News,https://www.bbc.co.uk/sport/football/51991426,Dybala becomes third Juventus player to test positive for coronavirus,"Dybala scored in Juve's last game - the behind closed doors match against Inter Milan on 8 March
Juventus and Argentina forward Paulo Dybala has tested positive for coronavirus.
In a message on his Instagram account, Dybala said he and his girlfriend both h… [+559 chars]",1
BBC News,https://www.bbc.co.uk/sport/football/51935585,Matuidi the second Juventus player to test positive for coronavirus,"Blaise Matuidi was part of the France team that won the World Cup in 2018
Juventus midfielder Blaise Matuidi has tested positive for coronavirus.
The Serie A club say that the France World Cup winner has been in voluntary isolation since 11 March and is ""we… [+227 chars]",1
BBC News,https://www.bbc.co.uk/news/52039642,Coronavirus: The fake Bill Gates post and other claims to ignore,"Whether it's a post on your uncle's account or an image your friend forwarded, fake coronavirus stories seem to be everywhere. 
To help, BBC teams are verifying and fact-checking the latest and most widely-seen examples of fake and misleading information. 
… [+5103 chars]",1
BBC News,https://www.bbc.co.uk/news/world-europe-51927790,Coronavirus: Spanish deaths surge close to 500,"Image copyrightEPAImage caption
 Spanish police guard the border with France near the village of Dantxarinea
Deaths from coronavirus in Spain surged to 491 on Tuesday from 309 the day before, health officials have said.
The number of confirmed cases also s… [+6253 chars]",1
BBC News,https://www.bbc.co.uk/news/in-pictures-51914110,Coronavirus: Empty streets throughout the world,"The outbreak of the coronavirus has led to the emptying of public spaces around the world, whether by government decree or by more personal responses.
Image copyrightANGELO CARCONI / EPAImage caption
 Pope Francis delivers his weekly prayers to an empty St … [+1632 chars]",1
BBC News,https://www.bbc.co.uk/news/world-australia-51992357,Coronavirus: Australian PM warns of lockdowns,"Image copyrightGetty ImagesImage caption
 Scott Morrison said the potential measures will be discussed on Sunday
Australian Prime Minister Scott Morrison warns the country could see lockdowns in a bid to curb coronavirus. 
The potential measures come after… [+2340 chars]",1
BBC News,https://www.bbc.co.uk/news/av/world-asia-india-51994194/coronavirus-india-observes-14-hour-curfew,Coronavirus: India observes 14-hour curfew,,1
BBC News,https://www.bbc.co.uk/sport/boxing/52084086,Anthony Yarde's father dies with coronavirus,"Anthony Yarde has won all 19 of his professional bouts, including 18 by knockout
Britain's Anthony Yarde has urged people to stay at home after his father died with the coronavirus.
The 28-year-old light-heavyweight said his father had been ""fit with no hea… [+856 chars]",1
BBC News,https://www.bbc.co.uk/news/world-asia-china-52075022,Coronavirus cradle Wuhan partly reopens after lockdown,"Image copyrightAFPImage caption
 Many of those arriving in Wuhan on Saturday pulled suitcases behind them as they returned to their families
The city in China where the coronavirus pandemic began, Wuhan, has partially re-opened after more than two months of… [+16614 chars]",1
BBC News,https://www.bbc.co.uk/news/uk-52139895,Coronavirus: Dealing with addiction while in lockdown,"Image caption
 Laurie Wright: ""The meetings were my saving grace""
The coronavirus lockdown has been especially tough for people in recovery from addiction because support meetings have been cancelled.
Musician Laurie Wright, 28, from Cheltenham, has been i… [+8280 chars]",1
BBC News,https://www.bbc.co.uk/news/world-asia-52178510,"Coronavirus: Singapore quarantines 20,000 migrant workers","Image copyrightReutersImage caption
 Migrant workers in Singapore's central business district in February
Singapore has told 20,000 foreign workers to stay in their dormitories for 14 days as coronavirus cases increase in the city state.
Two dormitories ha… [+2444 chars]",1
CNN,https://www.cnn.com/videos/world/2020/03/24/men-higher-gender-mortality-rate-coronavirus-foster-pkg-vpx.cnn,Troubling coronavirus statistic emerges,Chat with us in Facebook Messenger. Find out what's happening in the world as it unfolds.,0
CNN,https://www.cnn.com/2020/03/12/health/coronavirus-q-and-a-thursday-march-12/index.html,"4 of your latest coronavirus questions, answered","(CNN)CNN readers are asking smart questions about coronavirus every day. So each weekday, we'll select some of the top questions and get you the answers.
Here are some of the most popular recent questions:
Q. Does donated blood get screened for coronavirus?… [+3680 chars]",0
CNN,https://www.cnn.com/2020/03/20/politics/kfile-robocalls-coronavirus-scammers/index.html,Scammers use robocalls to falsely offer free coronavirus test kits,,0
CNN,https://www.cnn.com/videos/politics/2020/03/14/trump-handshakes-coronavirus-press-briefing-vpx.cnn,"Exec dodges Trump's handshake, offers elbow instead",Chat with us in Facebook Messenger. Find out what's happening in the world as it unfolds.,0
CNN,https://www.cnn.com/videos/health/2020/03/31/deborah-birx-coronavirus-death-graphs-community-sot-vpx-tsr.cnn,Birx: This begins and ends with community,Chat with us in Facebook Messenger. Find out what's happening in the world as it unfolds.,0
CNN,https://www.cnn.com/2020/03/08/politics/2020-election-week-ahead/index.html,Analysis: Is coronavirus Trump's Katrina?,"THE POINT -- NOW ON YOUTUBE! 
In each episode of his weekly YouTube show, Chris Cillizza will delve a little deeper into the surreal world of politics. Click to subscribe!",0
CNN,https://www.cnn.com/world/live-news/coronavirus-outbreak-03-30-20-intl-hnk/index.html,"Coronavirus cases top 721,000 globally","Mainland China reported 31 new novel coronavirus cases as of the end of day Sunday, bringing the national total to 81,470, according to the National Health Commission. 
All but one of the new cases are from inbound travelers. 
One case was transmitted domes… [+388 chars]",0
CNN,https://www.cnn.com/videos/politics/2020/03/17/trump-coronavirus-response-avlon-reality-check-newday-vpx.cnn,Avlon: Coronavirus is Trump's kryptonite,Chat with us in Facebook Messenger. Find out what's happening in the world as it unfolds.,0
CNN,https://www.cnn.com/videos/politics/2020/03/28/family-coronavirus-van-dang-ocallahan-biden-townhall-cooper-vpx.cnn,Mom asks Biden difficult virus question,Chat with us in Facebook Messenger. Find out what's happening in the world as it unfolds.,0
CNN,https://www.cnn.com/videos/politics/2020/03/27/trump-signing-oval-office-acosta-tsr-vpx.cnn,Oval Office photo: Why no Democrats were invited,Chat with us in Facebook Messenger. Find out what's happening in the world as it unfolds.,0
CNN,https://www.cnn.com/videos/politics/2020/03/23/trump-birx-fever-walk-away-briefing-tsr-vpx.cnn,Trump jokes with health official after she mentions low fever,Chat with us in Facebook Messenger. Find out what's happening in the world as it unfolds.,0
CNN,https://www.cnn.com/videos/politics/2020/04/02/trump-second-coronavirus-test-sot-vpx.cnn,Second time: Why Trump took another coronavirus test,Chat with us in Facebook Messenger. Find out what's happening in the world as it unfolds.,0
CNN,https://www.cnn.com/videos/politics/2020/04/04/donald-trump-hydroxychloroquine-coronavirus-sot-vpx.cnn,Trump on unproven coronavirus treatment: Try it,Chat with us in Facebook Messenger. Find out what's happening in the world as it unfolds.,0
CNN,https://www.cnn.com/2020/03/10/success/travel-insurance-claims-change/index.html,Your travel insurance might now cover coronavirus,,0
CNN,https://www.cnn.com/videos/health/2020/03/13/part-1-coronavirus-town-hall-fact-fears-march-12-2020-sot-vpx.cnn,Watch the entire CNN coronavirus town hall,Chat with us in Facebook Messenger. Find out what's happening in the world as it unfolds.,0
CNN,https://www.cnn.com/videos/us/2020/03/21/law-enforcement-coronavirus-smerconish-commentary-vpx.cnn,Smerconish on how coronavirus impacts law enforcement,Chat with us in Facebook Messenger. Find out what's happening in the world as it unfolds.,0
CNN,https://www.cnn.com/2020/03/24/health/marriage-coronavirus-wellness/index.html,Can your marriage survive the coronavirus?,"(CNN)Even for those of us with the happiest and most stable marriages, social distancing to combat the spread of Covid-19 provides some serious challenges to our respective unions. 
We're confined to small spaces with our spouses, with little to no reprieve.… [+10211 chars]",0
CNN,https://www.cnn.com/videos/politics/2020/03/16/president-trump-rates-coronavirus-response-presser-sot-vpx.cnn,Trump grades himself on coronavirus response,Chat with us in Facebook Messenger. Find out what's happening in the world as it unfolds.,0
CNN,https://www.cnn.com/2020/03/17/tech/cvs-false-coronavirus/index.html,CVS sent false coronavirus information to staff,"New York (CNN Business)CVS mistakenly sent false information to its staff about how to combat the coronavirus, a spokesperson for the company confirmed to CNN Business on Tuesday.
The email, sent Monday by CVS Chief Medical Officer Troy Brennan, falsely sugg… [+1754 chars]",0
CNN,https://www.cnn.com/videos/politics/2020/03/16/trump-walks-back-coronavirus-comments-lead-vpx.cnn,Watch Trump walk back coronavirus remark,Chat with us in Facebook Messenger. Find out what's happening in the world as it unfolds.,0
BBC News,https://www.bbc.co.uk/news/uk-england-leicestershire-51807638,Therapy dog stolen from girl with autism found dead,"Image copyrightGemma HopkinsImage caption
 Gemma Hopkins said her daughter Chloe and Lottie had ""an amazing bond""
A therapy dog that was stolen from a 12-year-old girl with autism has been found dead.
Three-year-old Dalmatian Lottie was taken from the home… [+1475 chars]",1
Independent,https://www.independent.co.uk/life-style/health-and-families/world-autism-awareness-week-asperger-syndrome-symptoms-a9433311.html,World Autism Awareness Week 2020: What is Asperger syndrome and how many people does it affect?,"Asperger syndrome is a developmental disorder that can make it harder for those affected to interact with others in a social environment.
The condition is an autism spectrum disorder, meaning that those with Asperger syndrome may exhibit different characteri… [+5827 chars]",1
BBC News,https://www.bbc.co.uk/news/av/education-51877434/autism-how-to-talk-to-a-child-about-their-autism,Autism: How to talk to a child about their autism,,1
BBC News,https://www.bbc.co.uk/news/uk-england-tees-51949361,Whorlton Hall abuse: 'Devious staff' misled inspectors,"Image caption
 Whorlton Hall was a 17-bed unit for adults with learning difficulties and autism
Failings by the care watchdog and a ""toxic culture"" may have allowed ""devious staff"" to abuse vulnerable hospital residents, a review has found.
Whorlton Hall i… [+3221 chars]",1
Politico,https://www.politico.com/news/2020/03/21/anti-vaccine-coronavirus-137446,Anti-vaxx politicians under fire as coronavirus spreads,"Anti-vaccine advocacy is a growing force in American politics and around the globe as formerly fringe activists have developed a wide reach across social media platforms. Other candidates who oppose mandatory vaccinations are running for office, and some are … [+4954 chars]",1
BBC News,https://www.bbc.co.uk/news/uk-wales-51843565,Mental health placements: Ayla Haines 'petrified' over move,"Image copyrightFamily photoImage caption
 Ayla Haines has been receiving care in Northampton since 2016
A Carmarthenshire woman placed in a secure mental health unit in England will be moved after NHS Wales suspended placements there.
The Welsh Government … [+4178 chars]",1
Independent,https://www.independent.co.uk/news/health/coronavirus-nhs-treatment-disabled-autism-nice-covid-19-a9423441.html,Coronavirus: U-turn on critical care advice for NHS amid fears disabled people will be denied treatment,"Emergency guidance to help doctors decide who should get critical care during the coronavirus outbreak is being urgently re-written after a U-turn by a national health watchdog over fears it could mean disabled people are denied treatment.
The National Insti… [+4486 chars]",1
The Washington Post,http://www.washingtonpost.com/politics/the-new-biden-shorter-speeches-and-less-time-for-gaffes/2020/03/09/b5bacf28-61a9-11ea-845d-e35b0234b136_story.html,Shorter speeches give fewer chances for gaffes...,"KANSAS CITY, Mo. - As Joe Biden cradles a delegate lead through the handful of primary states that will vote Tuesday, he has unleashed a rarely used weapon in what has become a two-man battle for the Democratic presidential nomination:
Brevity.
Biden's even… [+6474 chars]",1
Independent,https://www.independent.co.uk/life-style/coronavirus-nhs-nightingale-hospital-rainbows-art-drawing-painting-a9452806.html,Coronavirus: Rainbow posters from around the country show how children pay tribute to NHS workers,"During the coronavirus pandemic, the rainbow has become a symbol of support for people wanting to show solidarity with NHS workers on the front line.
The trend was reportedly started by a nurse who wanted to create a sign of hope for patients and staff in ho… [+2097 chars]",1
Independent,https://www.independent.co.uk/news/world/americas/coronavirus-vaccine-anti-vaxxer-donald-trump-a9426151.html,"Anti-vaccination movement could derail fight against coronavirus, experts warn","The global anti-vaccination movement could cause a resurgence of the deadly coronavirus outbreak and others like it in the years to come, experts have warned. 
Laboratories around the world are rushing to create a vaccine that will stop the spread of the Cov… [+6684 chars]",1
Independent,https://www.independent.co.uk/life-style/coronavirs-pandemic-homeless-people-vulnerable-group-charities-a9408796.html,"Coronavirus: Homeless should be treated as 'vulnerable group' amid pandemic, say charities","Rough sleepers should be recognised as a vulnerable group amid the coronavirus pandemic, leading charities have said.
Ten organisations - including homeless charities Crisis, St Mungos and Centrepoint - urged the government to make extra provisions for those… [+30333 chars]",1
Independent,https://www.independent.co.uk/life-style/health-and-families/coronavirus-ireland-help-vulnerable-self-isolation-covid-19-a9399826.html,Coronavirus: Volunteers in Ireland rally to help vulnerable people in self-isolation,"Volunteers in Ireland have rallied on social media to provide support for the most vulnerable as the government ramps up plans to battle the spread of Covid-19.
Thousands of Good Samaritans took to Twitter using the hashtag #Selfisolationhelp to offer assist… [+29142 chars]",1
Independent,https://www.independent.co.uk/life-style/health-and-families/coronavirus-teacher-wash-clean-hands-covid-19-outbreak-a9400181.html,Coronavirus: Teacher devises genius hack to ensure pupils wash their hands,"A teacher has come up with a genius hack to ensure that her pupils wash their hands in a bid to stop the spread of coronavirus.
Shauna Woods, 29, who teaches at Hallsville Schools in Hallsville, Missouri, uses a custom stamp with the enscription: Mrs. Woods … [+28479 chars]",1
Reuters,https://www.reuters.com/article/us-health-coronavirus-usa-schools-idUSKBN21A30X,Coronavirus forces New York City schools into daunting experiment with teaching from afar,"NEW YORK (Reuters) - Her students are used to seeing her in the classrooms of Adrien Block Intermediate School 25 in New York City’s Flushing neighborhood, but on Monday morning “Miss Brooke” appeared instead on their laptop and phone screens, sitting in her … [+3209 chars]",1
Independent,https://www.independent.co.uk/extras/indybest/us/best-weighted-blankets-amazon-reviews-2020-a9287681.html,10 best weighted blankets according to Amazon reviews,"Hugs fill our body with feel-good hormones, and given weighted blankets make you feel like getting a big hug it's understandable why so many people swear by them being a bedtime gamechanger.
Weighted blankets have been shown to ease insomnia, anxiety and PTS… [+11656 chars]",1
Independent,https://www.independent.co.uk/voices/schools-close-vulnerable-coronavirus-gavin-williamson-boris-johnson-a9411181.html,"As an educational psychologist, these are the tools parents and teachers really need now that schools are closed","On Wednesday, Gavin Williamson announced in the commons that schools will close to all but vulnerable children including those who have a social worker and those with educational health and care plans in light of measures to tackle coronavirus. At present, it… [+7738 chars]",1
Independent,https://www.independent.co.uk/arts-entertainment/tv/news/netflix-uk-april-2020-films-tv-shows-full-list-coronavirus-lockdown-a9434061.html,New on Netflix UK in April 2020: Every film and TV series being added during coronavirus lockdown,"You might be relying on Netflix now more than ever for new titles to watch.
With the country in partial lockdown due to the spread of coronavirus, people are on the hunt for things to occupy them and fortunately, the streaming service has a bursting list of … [+23317 chars]",1
Independent,https://www.independent.co.uk/arts-entertainment/tv/news/netflix-us-april-2020-movies-tv-shows-full-list-coronavirus-lockdown-a9434626.html,New on Netflix US in April 2020: Every movie and TV show being added during coronavirus lockdown,"You might be relying on Netflix now more than ever for new titles to watch.
With the country in partial lockdown due to the spread of coronavirus, people are on the hunt for things to occupy them and fortunately, the streaming service has a bursting list of … [+23669 chars]",1
BBC News,https://www.bbc.co.uk/news/uk-england-51310036,Bruderhof: My dark past growing up in a rural English commune,"Image caption
 Samantha says she began self-harming as a child to ""escape"" life in the Bruderhof
A group of Christians living together in communes believe their simpler, shared existence is the answer to society's ills. But some former members have told BBC… [+12444 chars]",1
BBC News,https://www.bbc.co.uk/news/uk-51960444,Pupils 'scared and anxious' about school closures,"Image copyrightFamily image Image caption
 Laila and Jack are having to adjust to life without school
""They're quite scared at the moment, if I'm honest,"" says Lucy of her children, Laila, 11, and Jack, 10. 
""They're worried they're going to catch it, they… [+4238 chars]",1
CNN,https://www.cnn.com/ampstories/entertainment/autism-awareness-day-these-tv-shows-portray-characters-on-the-spectrum,Autism Awareness Day: These TV shows portray characters on the spectrum - CNN,"Boys are more likely to be diagnosed with autism than girls, according to the CDC. Not only does this Freeform series offer a female perspective, but actress Kayla Cromer, who plays Matilda, is on the spectrum herself.",0
CNN,https://www.cnn.com/2020/03/29/world/five-things-march-29-trnd/index.html,"Start your Monday smart: Pandemic, stay home, equal pay, US census, culture online","Are you a health care worker fighting Covid-19? Send CNN a message on WhatsApp about the challenges you're facing, +1 347-322-0415.
 (CNN)In times of crisis, Mr. Rogers taught us to look for the helpers. That might be as easy as looking in the mirror. Here a… [+4588 chars]",0
CNN,https://www.cnn.com/2020/03/11/health/vans-autism-awareness-shoe-collection-trnd/index.html,Vans releases new Autism Awareness Collection designed with sensory-inclusive elements,,0
Buzzfeed,https://www.buzzfeed.com/alexspence/people-mental-health-conditions-coronavirus-treatment,People With Mental Health Conditions Say The Coronavirus Has Plunged Their Treatment Into Crisis,"The journalists at BuzzFeed News are proud to bring you trustworthy and relevant reporting about the coronavirus. To help keep this news free,become a memberand sign up for our newsletter,Outbreak Today.
In January, Paul, a 27-year-old multimedia producer in… [+19488 chars]",0
Buzzfeed,https://www.buzzfeed.com/daniellaemanuel/girl-tiktok-autism,This 19-Year-Old TikToker Is Teaching Really Important Lessons About How Autism Presents In Women,,0
CNN,https://www.cnn.com/2020/04/05/us/us-coronavirus-teachers-school-closures/index.html,US teachers had days to re-define class amid a nationwide crisis. The weeks stuck in limbo haven't been easy,"By Christina Maxouris and Christina Zdanowicz, CNN
Updated 4:00 AM ET, Sun April 5, 2020
Chat with us in Facebook Messenger. Find out what's happening in the world as it unfolds.
(CNN)Kevin Klemm is going into his third week of teaching from home.
Since t… [+6231 chars]",0
Fox News,https://www.foxnews.com/sports/jazz-joe-ingles-drop-nba-career-autistic-son-coronavirus,Utah Jazz's Joe Ingles says he'd drop NBA career to protect autistic son from coronavirus threat,"Get all the latest news on coronavirus and more delivered daily to your inbox. Sign up here.
Utah Jazz forward Joe Ingles said he would retire from the NBA without hesitation if it meant keeping his son, who suffers from autism, safe from the threat of the c… [+1839 chars]",0
Fox News,https://www.foxnews.com/faith-values/coronavirus-video-bible-verse-siblings-minnesota-mom,"Girl, 6, teaches Bible verse to brother to ease coronavirus fear: video","A Minnesota mom's timely post about choosing faith over widespread fear surrounding the coronavirus outbreak is capturing the hearts of many.
Sheletta Brundidge, a comedian and mother of four, shared a video of her 6-year-old daughter teaching her brother a … [+3220 chars]",0
Fox News,https://www.foxnews.com/media/girl-bible-verse-brother-ease-coronavirus-fears,Mother of 6-year-old who eased brother's coronavirus fears with Bible verse: 'I felt blessed',"A Minnesota mother, who shared a video last week of her 6-year-old daughter teaching her brother a Bible verse to help ease his fear of the novel coronavirus, described that moment on “Fox &amp; Friends First” on Wednesday. 
“I was amazed,” Sheletta Brundidg… [+3482 chars]",0
