CNN,https://www.cnn.com/2020/03/12/us/police-officer-lunch-homeless-trnd/index.html,A police officer spent his lunch break sharing pizza with a homeless woman and it was captured in a heartwarming photo,"(CNN)Having been with the Goldsboro Police Department in North Carolina for the past nine years, Officer Michael Rivers has come to know the faces of the homeless in his community. But Wednesday, he came upon a homeless woman he had never seen before. And her… [+2608 chars]",0
CNN,https://www.cnn.com/2020/03/31/health/gupta-coronavirus-podcast-transcript-march-31-wellness/index.html,New Covid-19 listener questions answered: Dr. Sanjay Gupta's coronavirus podcast for March 31,"(CNN)As cases of Covid-19 rise, so do questions and uncertainties about it. In this episode, CNN Chief Medical Correspondent Dr. Sanjay Gupta responds to some of the e-mails and voice messages listeners have shared.
You can listen to this episode in your fav… [+8078 chars]",0
Buzzfeed,https://www.buzzfeed.com/hannahalothman/coronavirus-act-uk-police-powers-explained,Here's What You Need To Know About The New Coronavirus Powers For Police Across The UK,"The journalists at BuzzFeed News are proud to bring you trustworthy and relevant reporting about the coronavirus. To help keep this news free,become a memberand sign up for our newsletter,Outbreak Today.
The government has given police new powers to make sur… [+5996 chars]",0
Fox News,https://www.foxnews.com/health/drugs-tested-coronavirus-should-be-prescription-only-doc-warns,"Drugs being tested for coronavirus should be used by prescription only, doc warns","Get all the latest news on coronavirus and more delivered daily to your inbox. Sign up here.
As officials begin clinical trials for several coronavirus treatments, antimalarial medications and other antibiotics are beginning to trend online, prompting concer… [+2603 chars]",0
Fox News,https://www.foxnews.com/health/coronavirus-who-is-more-likely-to-die,Coronavirus' frightening profile: Who is more likely to die from COVID-19?,"Get all the latest news on coronavirus and more delivered daily to your inbox. Sign up here.
As coronavirus tears through the world, public health professionals and medical experts are endeavoring to solve the many mysteries surrounding who the novel disease… [+8910 chars]",0
Ars Technica,https://arstechnica.com/science/2020/04/cdc-reports-data-on-2500-covid-19-cases-in-kids-including-3-deaths/,"CDC reports data on 2,500 COVID-19 cases in kids, including 3 deaths","Enlarge/ NEW YORK, NEW YORK - MARCH 24: A child with a pacifier looks out a window as the coronavirus continues to spread across the United States on March 24, 2020 in New York City. The World Health Organization declared coronavirus (COVID-19) a global pande… [+6945 chars]",1
BBC News,https://www.bbc.co.uk/news/uk-england-cambridgeshire-52097453,Coronavirus: Asthma patient's mum 'scared' by inhaler shortage,"Image copyrightKylie HolmesImage caption
 Kylie Holmes could not find the find brown preventer inhaler for her daughter, who was close to running out.
A mother-of-four said she was brought to tears by her struggles to get an inhaler for her asthmatic daught… [+2752 chars]",1
BBC News,https://www.bbc.co.uk/news/uk-england-devon-51946867,Coronavirus: Fears for asthma and diabetes backpacker 'trapped' in Peru,"Media captionTom Brewerton: ""It's really urgent to get back""
A backpacker ""trapped"" in Peru is among more than 250 travellers trying to get back to the UK after flights out of the country were suspended.
Tom Brewerton, 27, has asthma and diabetes and has se… [+1476 chars]",1
Independent,https://www.independent.co.uk/life-style/health-and-families/coronavirus-asthma-world-day-symptoms-risk-a9454651.html,Coronavirus: What do people with asthma need to know?,"The National Institute for Health and Care Excellence (NICE) has published new guidelines for people suffering from asthma during the coronavirus outbreak.
The guidance has been published to ensure the safety of adults and children suffering from asthma duri… [+8202 chars]",1
Independent,https://www.independent.co.uk/arts-entertainment/music/news/tekashi-6ix9ine-coronavirus-prison-release-a9441421.html,Tekashi 6ix9ine could be released from prison early due to coronavirus pandemic,"Tekashi 6ix9ine could be released from prison early due to the coronavirus pandemic.
The rappers lawyer, Lance Lazzaro, told Rolling Stone that a recent request to grant his client real name Daniel Hernandez an early release seems likely to be successful.
L… [+1100 chars]",1
Reuters,https://www.reuters.com/article/us-health-asthma-poverty-idUSKBN20W2HX,Housing aid tied to fewer asthma emergencies for kids living in poverty,"(Reuters Health) - - Low-income children may have fewer asthma emergencies when their families receive housing subsidies that free up cash for health expenses, a U.S. study suggests. 
Among kids who had asthma attacks, those whose families received federal g… [+3109 chars]",1
Associated Press,https://apnews.com/484aebf9c88a1615c6ced8ba66c90dee,"Hay fever or virus? For allergy sufferers, season of worry...","HAMBURG, Pa. (AP) The spring breezes of 2020 are carrying more than just tree pollen. Theres a whiff of paranoia in the air.
For millions of seasonal allergy sufferers, the annual onset of watery eyes and scratchy throats is bumping up against the global spr… [+5664 chars]",1
Politico,https://www.politico.com/news/2020/03/22/suit-release-immigrant-families-coronavirus-142485,Suit seeks release of immigrant families due to virus risk,"Attorneys for the detained families alleged that the current conditions violate the Constitution, as well as a 1997 consent decree known as the Flores agreement, which requires a safe environment for minors in immigration custody.
Lawyers asked the court on … [+3022 chars]",1
Reuters,https://www.reuters.com/article/us-health-coronavirus-australia-stockpil-idUSKBN20Z1DC,"Eight weeks' worth of food - but let's not go crazy, says Sydney resident","SYDNEY (Reuters) - Sydney resident Dianne Regan has stockpiled enough food to last her household for eight weeks should the authorities impose a lockdown to stop the spread of the coronavirus. 
Her sense of urgency is even more pronounced because she lives w… [+1678 chars]",1
Independent,https://www.independent.co.uk/life-style/health-and-families/linda-lusardi-coronavirus-ill-sick-model-dancing-ice-a9410406.html,Coronavirus: Dancing On Ice star Linda Lusardi says she is 'extremely ill' with Covid-19,"Actor Linda Lusardi has said she is extremely ill with the coronavirus in response to a fan on Twitter.
Over the past few days and weeks, several celebrities have been informing their fans that they have contracted coronavirus, including Idris Elba and Tom H… [+3054 chars]",1
Politico,https://www.politico.com/news/2020/03/20/surgeon-general-jerome-adams-coronavirus-138397,Trump’s new public health 'star',"Until this month, Health and Human Services leaders had worked to limit Adams portfolio, worried that the voluble doctor would go off-script and fail to coordinate his messaging, said four officials in the health department who spoke on condition of anonymity… [+5897 chars]",1
Politico,https://www.politico.com/news/2020/04/01/federal-prisons-start-14-day-lockdown-to-fight-virus-158937,Federal prisons start 14-day lockdown to fight virus,"Limited group gathering will be afforded to the extent practical to facilitate commissary, laundry, showers, telephone, and [computer] access, the Bureaus announcement said. During this time, to the extent practicable, inmates should still have access to prog… [+4811 chars]",1
Independent,https://www.independent.co.uk/life-style/health-and-families/coronavirus-man-symptoms-battle-doctor-nurse-a9427601.html,Coronavirus: Man films battle with Covid-19 in bid to raise awareness of disease severity,"A video has been shared online of a mans battle with coronavirus in a bid to help raise awareness of the seriousness of the illness.
Nicola Hardwick posted a video of her husband Andy to Facebook in which he described his symptoms after contracting Covid-19 … [+2624 chars]",1
Reuters,https://www.reuters.com/article/us-health-coronavirus-synairgen-idUSKBN2153MA,Synairgen gets green light for coronavirus drug trial,"LONDON (Reuters) - British pharmaceutical company Synairgen said on Wednesday it had the go-ahead to test a drug that could boost the lung function of patients with coronavirus, potentially assisting in the global fight against the pandemic. 
The company sai… [+1475 chars]",1
The Washington Post,https://www.washingtonpost.com/nation/2020/04/07/coronavirus-is-infecting-killing-black-americans-an-alarmingly-high-rate-post-analysis-shows/,African Americans are at higher risk of death from coronavirus - The Washington Post,"As the novel coronavirus sweeps across the United States, it appears to be infecting and killing black Americans at a disproportionately high rate, according to a Washington Post analysis of early data from jurisdictions across the country.
The emerging star… [+9937 chars]",1
Reuters,https://www.reuters.com/article/us-health-coronavirus-cuba-idUSKBN21B04M,"Cuban government bans Cubans from leaving island, suspends schools over coronavirus","HAVANA (Reuters) - Cuba’s government said on Monday it was banning Cubans from leaving the country, closing schools and suspending interregional public transport in its fight to prevent the spread of the novel coronavirus. 
Havana started to ramp up measures… [+2358 chars]",1
Independent,https://www.independent.co.uk/news/world/americas/coronavirus-doctors-medical-staff-fired-ppe-resources-pandemic-a9439331.html,Coronavirus: US doctors warned they will be fired if they complain to media about lack of resources,"Hospitals are threatening to fire medical staff that talk to the media about working conditions or a lack of equipment during the coronavirus pandemic.
Bloomberg reports examples of disciplinary action taken against healthcare workers across the US, most sho… [+2499 chars]",1
Independent,https://www.independent.co.uk/arts-entertainment/tv/news/dr-oz-show-cancel-when-back-coronavirus-shutdown-employee-positive-covid-19-a9412561.html,Dr Oz employee tests positive for coronavirus after TV medic was attacked for telling people to eat berries,"The Dr Oz Show has reportedly shut down production after a staff member tested positive for coronavirus.
According to Variety, Dr Mehmet Oz will continue to film from home in order to air new episodes daily.
A source close to production told the publication… [+1866 chars]",1
Independent,https://www.independent.co.uk/sport/olympics/news/coronavirus-tokyo-2020-olympics-callum-skinner-thomas-bach-ioc-team-gb-a9418241.html,British champion Callum Skinner blasts 'arrogant' IOC president over handling Olympics amid coronavirus pandemic,"British Olympic champion Callum Skinner claims IOC president Thomas Bachs stubbornness and arrogance has spectacularly failed after Global Athlete called on Tokyo 2020 to be postponed.
The IOC announced a four-week deadline on Sunday before a final decision … [+1883 chars]",1
Independent,https://www.independent.co.uk/life-style/royal-family/coronavirus-prince-charles-test-positive-queen-royal-family-news-latest-a9424761.html,Coronavirus: MSP questions why Prince Charles was tested despite mild symptoms,"A member of the Scottish Parliament has questioned why the Prince of Wales was tested for the coronavirus despite only exhibiting mild symptoms.
On the governments website, it outlines that if a person is showing symptoms for Covid-19, they do not need to be… [+2239 chars]",1
CNN,https://www.cnn.com/2020/03/10/opinions/improve-chances-against-coronavirus-opinion-phillips/index.html,How to improve your chances,"James P. Phillips, MD, is an assistant professor of emergency medicine at the George Washington University, where he serves as chief of the Section of Disaster and Operational Medicine. Follow him on Twitter @DrPhillipsMD. The opinions expressed in this comme… [+5407 chars]",0
CNN,https://www.cnn.com/2020/04/06/opinions/smoking-vaping-covid-19-coronavirus-maa/index.html,Why Covid-19 might make you rethink your smoking habits,"John Maa, MD, is a past president of the San Francisco Marin Medical Society. The opinions expressed in this commentary are his own. Read more opinion at CNN.
 (CNN)A college friend who is now a physician first introduced me to an electronic cigarette in 200… [+7292 chars]",0
Buzzfeed,https://www.buzzfeed.com/emilyashton/coronavirus-teens-school,These Teens Want Their Schools Closed Down To Protect Themselves And Their Families From Coronavirus,"The government announced on Monday that everyone should now be avoiding unnecessary social contact but they said now was not the right time to close down schools, despite a number of other European countries taking that step.
""We think at the moment on balan… [+4494 chars]",0
CNN,https://www.cnn.com/2020/04/07/health/10-key-coronavirus-symptoms-wellness/index.html,Coronavirus symptoms: 10 key indicators and what to do,"(CNN)Scientists are learning more each day about the mysterious novel coronavirus and the symptoms of Covid-19, the disease it causes. 
Fever, cough and shortness of breath are found in the vast majority of all Covid-19 cases. But there are additional signal… [+12561 chars]",0
Buzzfeed,https://www.buzzfeed.com/sabavasefi/refugee-cough-asthma-immigration-detention-mantra-hotel,This Man With Respiratory Issues Is Stuck In Detention And Scared He Will Get COVID-19,"A man who has had a persistent cough for more than three years and is a suspected asthmatic is being detained with dozens of other men in a hotel doubling as an immigration detention centre as the coronavirus spreads across Australia.
I feel extremely weak. … [+4813 chars]",0
CNN,https://www.cnn.com/2020/04/02/us/tekashi-6ix9ine-coronavirus-release-trnd/index.html,Tekashi 6ix9ine's lawyer is 'hopeful' rapper will be released from prison because of coronavirus risk,,0
CNN,https://www.cnn.com/2020/03/31/asia/coronavirus-lockdown-impact-pollution-india-intl-hnk/index.html,The world's largest coronavirus lockdown is having a dramatic impact on pollution in India,"(CNN)When India imposed a nationwide lockdown a week ago, it was designed to stop the imminent spread of the novel coronavirus.
But grinding this country of 1.3 billion people to a near halt has also provided a temporary remedy to another pressing health iss… [+6335 chars]",0
CNN,https://www.cnn.com/2020/04/07/us/coronavirus-black-americans-race/index.html,Race: Why black Americans are at higher risk for coronavirus,"(CNN)Black Americans have more existing medical issues, less access to health care, and are more likely to work in unstable jobs -- all factors that have made the coronavirus pandemic disproportionately hurt blacks more.
While everyone is susceptible to Covi… [+6965 chars]",0
CNN,https://www.cnn.com/2020/03/21/us/ems-workers-covid-19-exposure/index.html,EMS workers expected to keep working after coronavirus exposure,"(CNN)Earlier this week, Christell Cadet was a healthy 34-year-old working as a paramedic in New York City. On Tuesday, she started having shortness of breath. By Wednesday, her symptoms were so severe she had to be hospitalized.
Cadet spoke to CNN through la… [+5848 chars]",0
CNN,https://www.cnn.com/2020/03/11/health/coronavirus-cold-allergies-flu-difference-symptoms-wellness-trnd/index.html,"Is it allergies, the flu or the coronavirus? How to tell the difference","(CNN)The coronavirus has infected more than 100,000 people worldwide. With all of the news of event cancellations, empty flights and health precautions (wash your hands!), it's natural that people may get a little anxious every time they feel a tickle in thei… [+5856 chars]",0
CNN,https://www.cnn.com/2020/04/07/opinions/covid-19-rural-areas-preparation-andelman/index.html,Surviving Covid-19 in the back of beyond,"David A. Andelman, Executive Director of The RedLines Project, is a contributor to CNN where his columns won the Deadline Club Award for Best Opinion Writing. Author of ""A Shattered Peace: Versailles 1919 and the Price We Pay Today,"" and the forthcoming ""A Re… [+6794 chars]",0
MTV News,http://www.mtv.com/news/3162060/tekashi-6ix9ine-early-prison-release-coronavirus/,Tekashi 6ix9ine Has Been Released From Prison Due To Coronavirus Concerns,"Tekashi 6ix9ine is a free man. Sort of.
The rapper, whose real name is Daniel Hernandez, was released from federal custody and into home confinement on Thursday (April 2) after a Manhattan judge granted his early release. U.S. District Judge Paul Engelmayer … [+1299 chars]",0
CNN,https://www.cnn.com/2020/03/27/politics/americans-repatriated/index.html,"State Department says it has repatriated 15,000 Americans but is tracking tens of thousands more","(CNN)The US State Department has repatriated more than 15,000 Americans who had been stuck abroad due to coronavirus but is still tracking tens of thousands more who may need assistance.
As of Friday afternoon, the agency had dispatched more than 150 flights… [+2762 chars]",0
CNN,https://www.cnn.com/2020/03/23/opinions/the-distance-a-new-york-family-in-love-and-fear-thomas-lake/index.html,A New York family in love and fear,"In a series of essays called The Distance, Thomas Lake is telling the stories of Americans living through the pandemic. This story is based on extensive phone interviews with the O'Donnell family. Email thomas.lake@cnn.com if you have a story to share.
 (CNN… [+5228 chars]",0
CNN,https://www.cnn.com/2020/03/12/opinions/coronavirus-prison-population-precautions-jones-jackson/index.html,Smart steps to prevent devastating coronavirus outbreaks in prisons,"CNN host Van Jones and Jessica Jackson are co-founders of #cut50, a bipartisan criminal justice initiative of the Dream Corps. Jones is also the CEO of the REFORM Alliance, an organization for which Jackson serves as the Chief Advocacy Officer. The opinions e… [+4619 chars]",0
CNN,https://www.cnn.com/2020/04/02/business/coronavirus-racial-gap/index.html,Why the coronavirus crisis will expand America's racial wealth gap,"New York City (CNN Business)The novel coronavirus has already dealt an unprecedented economic blow to a large portion of American workers, with a record 9.9 million people filing for unemployment over a two-week span from March 16 to March 29.
The full scope… [+4361 chars]",0
CNN,https://www.cnn.com/2020/03/12/opinions/coronavirus-vulnerability-while-sleeping-bruce-davidson/index.html,Doctor: How to reduce your vulnerability to coronavirus -- when sleeping,"Bruce L. Davidson MD, MPH is a pulmonary physician and researcher in Seattle, an expert in respiratory transmission of infection, and former president of the National Tuberculosis Controllers Association and member of the Advisory Council for the Elimination … [+4236 chars]",0
CNN,https://www.cnn.com/2020/04/06/health/respiratory-therapist-ventilators-coronavirus/index.html,Ventilators don't operate on their own. Why respiratory therapists are key to coronavirus treatment,"(CNN)The rapid spread of coronavirus has sent states scrambling to buy ventilators to prepare for a coming apex of cases. 
But ventilators do not operate on their own. And while the ventilator shortage remains a serious issue, much less attention has been pa… [+5611 chars]",0
CNN,https://www.cnn.com/2020/04/06/politics/aclu-prison-deaths-louisiana/index.html,ACLU suing for release of inmates at Louisiana facility where five prisoners have died,"(CNN)The ACLU sued the federal Bureau of Prisons on Monday, arguing that efforts to release inmates from a detention center in Oakdale, Louisiana, where five men have died from coronavirus, are moving too slowly. 
The low-security prison located 100 miles ou… [+4013 chars]",0
The American Conservative,https://www.theamericanconservative.com/articles/joe-biden-the-democrats-exhausted-surrender/,Joe Biden: The Democrats’ Exhausted Surrender,"We're about to find out whether anyone really would be better than Trump.How did the Democrats end up with Joe Biden as their presumptive nominee?
After three years of preparatory media fire about diversity and change, and chumming the electorate with promis… [+8476 chars]",0
BBC News,https://www.bbc.co.uk/sport/american-football/52176557,Tom Dempsey: New Orleans great dies after contracting coronavirus,"Tom Dempsey's NFL field goal record stood for 43 years
New Orleans Saints great Tom Dempsey has died aged 73 after contracting coronavirus.
Dempsey set the record for the longest NFL field goal with a 63-yard kick in 1970 - and it was only beaten in 2013.
… [+695 chars]",1
The Washington Post,https://www.washingtonpost.com/health/for-alzheimers-researchers-a-long-and-frustrating-struggle-to-find-a-drug/2020/04/03/4a845234-72a1-11ea-a9bd-9f8b593300d0_story.html,"For Alzheimer’s researchers, a long and frustrating struggle to find a drug - The Washington Post","In March 2019, Biogen announced that it had halted two clinical trials of the drug early after an interim analysis showed they werent working, but the company has since changed course, saying it intends to seek approval from the Food and Drug Administration b… [+7220 chars]",1
BBC News,https://www.bbc.co.uk/news/uk-england-52062256,Coronavirus: Self isolation when you are affected by dementia,"Image copyrightLiz BrookesImage caption
 Mike Brookes, an RAF veteran, has been living with dementia for nine years
As people are told to stay at home to stem the spread of coronavirus, some living with dementia are struggling to adapt to the change.
Mike … [+5234 chars]",1
BBC News,https://www.bbc.co.uk/news/uk-scotland-glasgow-west-51902133,Coronavirus: Six Covid-19 cases at South Lanarkshire care home,"A care home in South Lanarkshire has confirmed six cases of Covid-19
Residents of Highgate Care Home in Uddingston are being closely monitored and strict infection control measures have been put in place. 
NHS Lanarkshire said all relatives and staff were b… [+1297 chars]",1
The Washington Post,http://www.washingtonpost.com/national/disaster-waiting-to-happen-thousands-of-inmates-released-as-jails-face-coronavirus-threat/2020/03/24/761c2d84-6b8c-11ea-b313-df458622c2cc_story.html,UPDATE: Thousands of inmates released as jails face coronavirus threat...,"Amid fears that the coronavirus will carve a deadly path through prisons and jails, counties and states are releasing thousands of inmates - New Jersey alone began freeing hundreds of people this week - and the federal prison system is coming under intense pr… [+12820 chars]",1
Independent,https://www.independent.co.uk/life-style/gadgets-and-tech/news/artificial-intelligence-brain-implant-ai-mind-reading-neuralink-a9437806.html,Artificial intelligence translates thoughts into text using brain implant,"Scientists have developed an artificial intelligence system that can translate a person's thoughts into text by analysing their brain activity.
Researchers at the University of California, San Francisco, developed the AI to decipher up to 250 words in real-t… [+11863 chars]",1
Associated Press,https://apnews.com/9404a185bbb23c0d5c77e97292eb0540,Alzheimer's cafe in Lincoln meets need for fellowship,"LINCOLN, Neb. (AP) The idea was so simple, Michele Carlson says.
A safe space for people with Alzheimers and their caregivers.
A place to go to have coffee and cookies. Put together a puzzle, sing, draw, find fellowship, relax. A place where no one looked a… [+4026 chars]",1
Associated Press,https://apnews.com/046a40acdebbaf0f549e506b7fd013ee,California prepares for expected surge of coronavirus,"For most people, the coronavirus causes mild or moderate symptoms, such as fever and cough that clear up in two to three weeks. For some, especially older adults and people with existing health problems, it can cause more severe illness, including pneumonia a… [+1096 chars]",1
Associated Press,https://apnews.com/4e869afdb381dbd78fe9a454b5af404e,Minnesotans worry as COVID-19 spreads to nursing homes,"MINNEAPOLIS (AP) Minnesota residents are worried about their elderly loved ones as the coronavirus outbreak spreads to nursing homes.
At least 17 people living in nine senior care facilities across the state have become infected with COVID-19, the disease ca… [+1900 chars]",1
Independent,https://www.independent.co.uk/life-style/gadgets-and-tech/news/coronavirus-cure-vaccine-computer-research-distributed-folding-home-a9428931.html,"Hundreds of thousands sign up their computers to fight against coronavirus, creating vast collaborative research project","Hundreds of thousands of people have signed up their computer to help try and fight against the coronavirus outbreak.
The project is now about 10 times as powerful as the world's fastest supercomputer, according to the scientists behind it.
Folding@Home  a … [+2280 chars]",1
Associated Press,https://apnews.com/b3b75d7c49d6aaab589137923f19c67b,California prepares for coronavirus surge in week ahead,LOS ANGELES (AP) Californians endured a weekend of stepped-up restrictions aimed at keeping them home as much as possible while hospitals and health officials scrambled Sunday to ready themselves for a week that could see the feared dramatic surge in coronavi… [+3297 chars],1
